name,website,short_description,linkedin,categories,num_employees_enum,locations,founded_on,operating_status,founders
École secondaire catholique Paul-Desmarais,,École secondaire de langue française à Stittsville au Canada,https://www.linkedin.com/company/conseil-des-coles-catholiques-du-centre-est,"Education, Secondary Education",,Great Lakes,2/1/2016,active,
Écomarché SA,,Écomarché SA is owns and operates small supermarkets.,,"Consumer Goods, Retail",,"European Union (EU), Europe, Middle East, and Africa (EMEA)",1/1/1995,active,
Érbe Family Office,,Érbe Family Office is an investment firm.,https://www.linkedin.com/company/%C3%A9rbe-family-office,,,"European Union (EU), Europe, Middle East, and Africa (EMEA)",,active,
Établissement Peugeot Frères,,The holding company of the Peugeot family group,https://www.linkedin.com/company/etablissements-peugeot-freres-sa/mycompany/,,,,1851-01-01,active,
Éxito Educativo,,Éxito Educativo is an after-school program that promotes academic success among Latino families.,,,,,,active,
Íope Ventures,,Íope Ventures operates as a venture capital firm.,,,,"European Union (EU), Europe, Middle East, and Africa (EMEA)",9/1/2022,active,
ÑECA S.A.S,,Actividades inmobiliarias realizadas con bienes propios o arrendados,,,,,,active,
Ó. Johnson og Kaaber,,Johnson og Kaaber is a progressive wholesale company with an extensive distribution network and a low overhead.,,,,"Nordic Countries, Scandinavia, Europe, Middle East, and Africa (EMEA)",1/1/1906,active,
Öhman Group,,Öhman Group is a responsible and independent fund manager.,https://www.linkedin.com/company/the-ohman-group,Asset Management,,"European Union (EU), Nordic Countries, Scandinavia, Europe, Middle East, and Africa (EMEA)",1/1/1906,active,Bankirfirman E. Öhman J
Örebro University School of Business,,Örebro University School of Business is a place where education and research meet in the four subjects.,https://www.linkedin.com/school/%C3%B6rebro-university-school-of-business,Higher Education,,"European Union (EU), Nordic Countries, Scandinavia, Europe, Middle East, and Africa (EMEA)",1/1/1991,active,
Östberg Group,,Östberg Group is one of the world leading duct fan producer located in Avesta.,https://www.linkedin.com/company/ostberg-americas/,"Industrial, Manufacturing, Mechanical Engineering",,"European Union (EU), Nordic Countries, Scandinavia, Europe, Middle East, and Africa (EMEA)",1/1/1981,active,
Östboskolan Värnamo.,,Östboskolan Värnamo.,,Higher Education,,"European Union (EU), Nordic Countries, Scandinavia, Europe, Middle East, and Africa (EMEA)",,active,
Östra Grevie Folkhögskola,,Östra Grevie Folkhögskola is one of Sweden's largest folk high schools which offer knowledge in a creative environment.,https://www.linkedin.com/company/ostragreviefolkhogskola,Education,,"European Union (EU), Nordic Countries, Scandinavia, Europe, Middle East, and Africa (EMEA)",1/1/2014,active,
Östra Reals gymnasium,,"Östra Reals Gymnasium is a secondary school institution located in Östermalm, Stockholm, Sweden.",,Education,,"European Union (EU), Nordic Countries, Scandinavia, Europe, Middle East, and Africa (EMEA)",,active,
Ørsted Propel acceleration programme,,Ørsted Propel is an acceleration program of sustainable energy company Ørsted in partnership with Rockstart.,https://www.linkedin.com/company/orsted,,,"European Union (EU), Nordic Countries, Scandinavia, Europe, Middle East, and Africa (EMEA)",1/1/2022,active,
Ørsted Ventures,,"Ørsted Ventures is an early stage, patient capital fund designed to help the next generation of climate entrepreneurs.",,,,,,active,
Østergaard Biler A/S,,Østergaard Biler A/S provides car rental services. ,,Railroad,,"European Union (EU), Nordic Countries, Scandinavia, Europe, Middle East, and Africa (EMEA)",1/1/1954,active,
Østfold University College,,Østfold University College provides education to about 7000 students and offers more than 100 study options.,https://www.linkedin.com/school/hogskolen-i-ostfold/,"Education, Higher Education, Universities",,"Nordic Countries, Scandinavia, Europe, Middle East, and Africa (EMEA)",1/1/1994,active,
Útgerðarfélag Reykjavíkur,,Útgerðarfélag Reykjavíkur is an Icelandic seafood company that owns and operates the freezer trawlers Gudmundur and Nesi RE.,https://www.linkedin.com/company/urseafood/,"Food and Beverage, Seafood",,"Nordic Countries, Scandinavia, Europe, Middle East, and Africa (EMEA)",1/1/1998,active,
Überblick Holding AG,,Investment,,,,,,active,
Übermorgen Ventures,,We are an early stage venture fund backing entrepreneurs that build profitable solutions to fight climate change,https://www.linkedin.com/company/%C3%BCbermorgen-ventures/,,,"Europe, Middle East, and Africa (EMEA)",1/1/2019,active,Adrian Bührer
Ünlü Portföy,,Ünlü Portfolio R&D Venture Capital Investment Fund is an investment fund.,,,,,,active,
Üsküdar University,,Üsküdar University is a thematic university in the fields of behavioral health and sciences.,https://www.linkedin.com/company/uskudar-universitesi,,,"Europe, Middle East, and Africa (EMEA), Middle East, Europe, Middle East, and Africa (EMEA)",3/3/2011,active,
ælf,,"ælf is a decentralized Cloud Computing Blockchain Network, featuring parallel processing and nodes clustering to enable scaling...",https://www.linkedin.com/company/aelfblockchain,"Blockchain, Cloud Computing, Internet",,"Asia-Pacific (APAC), Association of Southeast Asian Nations (ASEAN), Southeast Asia",1/1/2017,active,"Haobo Ma, Zhuling Chen"
èlevit,,Technology for Smart Surface,https://www.linkedin.com/company/èlevit/,"Hardware, Product Design",,"European Union (EU), Europe, Middle East, and Africa (EMEA)",12/17/2021,active,
être Venture Capital,,être Venture Capital is a venture capital firm run by women that encourages and supports mission-driven business owners.,https://www.linkedin.com/company/%C3%AAtre/,,,"San Francisco Bay Area, West Coast, Western US",1/1/2022,active,
āltitude,,"āltitude is closing the European SME Tech Gap by investing in (pre-)seed B2B software startups with a focus on people, product, and process.",https://www.linkedin.com/company/%C4%81ltitude,"Artificial Intelligence (AI), Information Technology, SaaS, Small and Medium Businesses, Software, Sustainability",,"European Union (EU), Europe, Middle East, and Africa (EMEA)",1/1/2022,active,
ēllu app,,"ēllu an innovative communication app and wearable. It helps users communicate better, protect their safety, and plan better their life.",https://www.linkedin.com/company/ellu-company/?lipi=urn%3Ali%3Apage%3Acompanies_company_about_index%3Ba53da6b6-83be-4254-9084-b0e7c23bde80,"Communication Hardware, Consumer Software",,,1/1/2020,active,
İTÜNOVA,,İTÜNOVA offers academic studies and new technologies developed in Istanbul Technical University (ITU).,https://www.linkedin.com/in/itunovatto/,"EdTech, Education",,"Europe, Middle East, and Africa (EMEA), Middle East, Middle East and North Africa (MENA), Europe, Middle East, and Africa (EMEA)",2/1/2013,active,
İstanbul Portföy Yönetimi,,İstanbul Portföy Yönetimi is an investment management firm based in Turkey.,https://www.linkedin.com/company/istanbul-portf-y,Venture Capital,,"Europe, Middle East, and Africa (EMEA), Middle East, Middle East and North Africa (MENA), Europe, Middle East, and Africa (EMEA)",1/1/2007,active,
İzmir University of Economics,,İzmir University of Economics is a school in Izmir.,https://www.linkedin.com/company/izmir-university-of-economics_2,,,"Europe, Middle East, and Africa (EMEA), Middle East, Middle East and North Africa (MENA), Europe, Middle East, and Africa (EMEA)",1/1/2001,active,
Łódzka Specjalna Strefa Ekonomiczna S.A.,,Special Economic Zone of Lodz,https://www.linkedin.com/company/lodz-special-economic-zone/,,,"European Union (EU), Europe, Middle East, and Africa (EMEA)",1/1/1997,active,
Ślisz-Sandecka Kozioł,,Ślisz-Sandecka Kozioł is an investment firm.,https://www.linkedin.com/company/ssklegal/,,,"European Union (EU), Europe, Middle East, and Africa (EMEA)",,active,
Şerif Çorap,,"Şerif Çorap designs, manufactures, and supplies socks for men, women, and children.",https://www.linkedin.com/company/%C5%9Ferif-%C3%A7orap-a-%C5%9F,"Apparel, Manufacturing, Wholesale",,"Europe, Middle East, and Africa (EMEA), Middle East, Middle East and North Africa (MENA), Europe, Middle East, and Africa (EMEA)",1/1/1957,active,
Škoda Auto,,"Škoda is a Czech automobile maufacturer founded in 1895 as Laurin and Klement based in Mladá Boleslav, Czech Republic",https://www.linkedin.com/company/skoda-auto/,"Automotive, Manufacturing",,"Europe, Middle East, and Africa (EMEA)",1895-01-01,active,"Václav Klement, Václav Laurin"
​Masto,,Masto produces consumer electronics with the help of recycled materials to provide alternative options at affordable prices.,,"Consumer Electronics, E-Commerce, Hardware, Recycling",,,1/1/2018,active,
​Seed Money,,"Seed Money supports entrepreneurial initiatives with very high potential, at the first steps of their development plan.",https://www.linkedin.com/company/seedmoney-srl/,"Finance, Financial Services, Real Estate Investment",,"European Union (EU), Europe, Middle East, and Africa (EMEA)",1/1/2016,active,
​University of Akron ​Research ​Foundation​,,"​University of Akron ​Research ​Foundation offers resources for entrepreneurs, students, and faculty to innovate and launch ideas.",https://www.linkedin.com/showcase/university-of-akron-research-foundation/,"Education, Innovation Management",,"Great Lakes, Midwestern US",1/1/2001,active,
​Wadai Channel,,​​Wadai Channel is an information site that introduces popular products on TV and on the Internet.,,"Broadcasting, Information Services, Internet, TV, TV Production",,Asia-Pacific (APAC),1/1/2010,active,
‎Dubai National School,,‎Dubai National School offers an international educational program.,https://www.linkedin.com/company/dubai-national-school---al-barsha/,"Education, Higher Education",,"Europe, Middle East, and Africa (EMEA), Gulf Cooperation Council (GCC), Middle East, Middle East and North Africa (MENA)",1/1/1988,active,
‎Integr8d Capital,,‎Integr8d Capital is an investment Firm.,https://www.linkedin.com/company/integr8d-capital/,,,"Greater Houston Area, Southern US",1/1/2017,active,John S. Reale
‎Leopold-Franzens University of Innsbruck‎,,‎Leopold-Franzens University of Innsbruck‎ is a public research university that focuses primarily on research and development.,https://www.linkedin.com/company/universit-t-innsbruck,,,"European Union (EU), Europe, Middle East, and Africa (EMEA)",1669-01-01,active,
‎‎‎‎‎‎‎‎‎‎‎‎‎‎‎‎‎‎‎‎‎‎‎‎‎‎‎‎‎‎‎‎‎‎‎‎‎‎‎‎‎‎‎‎‎‎‎‎‎‎,,‎‎‎‎‎‎‎‎‎‎‎‎‎‎‎‎‎‎‎‎‎‎‎‎‎‎‎‎‎‎‎‎‎‎‎‎‎‎‎‎‎‎‎‎‎‎‎‎‎‎,,,,,,active,
“SAS” Autosystemtechnik,,“SAS” Autosystemtechnik is a global provider of assembly and logistics services for the automotive industry.,,,,,,active,
고질라 VS. 콩 (2021) 한국 최신 영화 다시 보기,,기타 | 영화 고질라 VS. 콩 다시보기 (2020개봉) 다운로드 (Rock) 무료보기,,,,,,active,
기술보증기금,,技保는 기술보증기금법에 의해 설립된 정부출연기관으로서 기술혁신형 기업에 기술보증 및 기술평가를 중점지원하여 기업의 기술경쟁력을 제고하고 나아가 우리경제의 지속적인 성장동력 창출의 일익을 담당하고 있는 기술금융 전문지원기관입니다.,,,,,,active,
샌즈카지노,,"우리카지노 | 샌즈카지노 | 플러스카지노 | 대한민국, 샌즈카지노 최고의 www.zzang79.com 온라인카지노로써 우리계열 대표 브랜드입니다.",,"Casino, Media and Entertainment, Social Media",c_00101_00250,,1/1/2021,active,
Ｔ&Ｋ ＴＯＫＡ,,"Ｔ&Ｋ ＴＯＫＡ is a manufacture and sale of ink for various printing and synthetic resin for printing, painting and adhesive.",,"Manufacturing, Printing",,Asia-Pacific (APAC),12/23/1949,active,
