name,website,short_description,linkedin,categories,num_employees_enum,locations,founded_on,operating_status,founders
"uLogica, LLC",http://www.ulogica.com,"Specializing in the commercialization of innovative technologies that deliver health, social and/or environmental benefits.",https://www.linkedin.com/company/ulogica,"Agriculture, Bioinformatics, Biopharma, Biotechnology, Business Development, CleanTech, Impact Investing, Life Science, Nanotechnology, Pharmaceutical",c_00011_00050,"Dallas/Fort Worth Metroplex, Southern US",7/6/2015,active,Dominic Brown
uLouder,http://www.ulouder.com/,uLouder is a local platform which connects end-users to self determined geographical radius to seek information or publish announcements.,https://www.linkedin.com/company/ulouder/,"Information Technology, Location Based Services",c_00011_00050,"Greater Philadelphia Area, East Coast, Southern US",8/17/2016,active,"Can Poyrazoğlu, Demirhan Erim"
uLumos,https://ulumos.com/,uLumos is the only Marketing Automation Solution to run business.,https://www.linkedin.com/company/ulumos,"Computer, Software",c_00001_00010,"Greater Denver Area, Western US",1/1/2017,active,
uMETHOD Health,https://umethod.com,uMETHOD has developed a precision-medicine engine for chronic diseases that provides patients with customized care.,https://www.linkedin.com/company/umethod,"Health Care, Medical",c_00011_00050,"Research Triangle, East Coast, Southern US",1/1/2013,active,Vik Chandra
uMake,http://www.umake.xyz,uMake offers an application that enables iPad users to create designs in 3D form.,https://www.linkedin.com/company/3967632,"3D Technology, iOS, Mobile Apps, Software, Video, Virtual Reality",c_00001_00010,"San Francisco Bay Area, West Coast, Western US",4/1/2014,active,"Erik Sapir, Evi Meyer"
uMake,https://www.umake.com,"uMake is a design software for 3D design, product design, and CAD modeling.",https://www.linkedin.com/company/umake,"3D Technology, Graphic Design, Information Technology, Interior Design, Marketing, Mobile Apps, Product Design, Social Media, Software, UX Design",c_00001_00010,"San Francisco Bay Area, Silicon Valley, West Coast, Western US",1/1/2014,active,
uMentioned,http://www.umentioned.com/,uMentioned is a college-based location app that allows its users to get connected with the online campus community.,http://www.linkedin.com/company/umentioned,"Location Based Services, Mobile Apps, Universities",c_00011_00050,Great Lakes,11/18/2012,active,"Ade Labinjo, Alice Li, Christopher Travers, Henry Shi"
uMobi Solutions Corporation,http://www.umobisolutions.com,"uMobi Solutions Corporation is a technology management solutions firm headquartered in Princeton, New Jersey.",https://www.linkedin.com/company/natteron/,Software,,"East Coast, Northeastern US",1/1/2017,active,
uMore,https://umore.app/,"uMore is an AI-powered mental health tracker that helps users identify patterns, build positive habits, and share progress.",https://www.linkedin.com/company/umoreapp/,"Artificial Intelligence (AI), Health Care, Mental Health, Mobile, Wellness",c_00011_00050,"Greater Miami Area, East Coast, Southern US",1/1/2020,active,"Alejandro Serrano Saunders, Carl Yates, Joel Stephano, Maria de Freitas"
uMortgage Solutions,https://umortgagesolutions.com,uMortgage Solutions provides mortgage lending and home loan assistance services.,https://www.linkedin.com/company/umortgage-solutions/about/,"Advice, Financial Services, Lending",c_00001_00010,"East Coast, Southern US",,active,
uNAvo,http://unavo.com/,uNAvo is to provide the telecom industry with software that allows communication companies the ability to lower their cost & work.,https://www.linkedin.com/company/unavo-inc./,"Consulting, Marketing, Sales, Software, Telecommunications, Web Design",c_00011_00050,"East Coast, Southern US",,active,
uPage,https://www.upage.pk,"uPage is a free-to-use website creation platform targeting people in developing economies such as India, Pakistan, Bangladesh etc.",https://www.linkedin.com/company/upage/,"Internet, Web Development",c_00001_00010,"Greater New York Area, East Coast, Northeastern US",1/1/2018,active,
uParts,http://www.uparts.com,"uParts is an online platform helping repair professionals, insurance carriers, and part suppliers conduct transactions over the internet.",https://www.linkedin.com/company/uparts-inc-/,"Information Services, Information Technology",c_00001_00010,"Greater Los Angeles Area, West Coast, Western US",1/1/2011,active,Alexander Adegan
uPerform,http://www.uperform.com,A just-in-time learning and support platform delivering learning opportunities within the flow of work for business and healthcare software.,https://www.linkedin.com/company/uperform-training-and-support/,"Corporate Training, E-Learning, Enterprise Resource Planning (ERP), Software, Training",c_00051_00100,"Greater Baltimore-Maryland Area, East Coast, Southern US",1/1/2010,active,
uPet,https://upet.co,"uPet is an online platform that provides pet innovation, online shopping, and pet accessories.",https://www.linkedin.com/company/upet-co,"E-Commerce, Pet, Shopping",c_00001_00010,"West Coast, Western US",1/1/2012,active,
uPnP Forum,http://upnp.org/,UPnP Forum is an industry initiative of members working to enable easier device-to-device interoperability and better home networking.,https://www.linkedin.com/company/upnp-forum,"Compliance, Consumer Electronics, Smart Home",c_05001_10000,"West Coast, Western US",1/1/1999,active,
uPort,https://www.uport.me/,uPort is a self-sovereign identity and user-centric data platform.,https://www.linkedin.com/company/uport/about/,"Blockchain, Ethereum, FinTech",c_00001_00010,"Greater New York Area, East Coast, Northeastern US",1/1/2016,active,Pelle Braendgaard
uPundit,https://www.upundit.com,Utilizing social networks and artificial intelligence technology uPundit provide students a platform to find the study resources.,https://www.linkedin.com/company/upundit.com,"Artificial Intelligence (AI), Education, Service Industry",c_00001_00010,"Greater New York Area, East Coast, Northeastern US",1/1/2015,active,
uQQn,http://www.uQQn.com,Small Business Network,,"Finance, GreenTech, Internet, Non Profit, Small and Medium Businesses, Web Development",c_00001_00010,"Greater Philadelphia Area, Great Lakes, Northeastern US",1/1/2003,active,
uQontrol,http://qkey.com,"uQontrol is a technology start-up focused on creating more secure, intuitive and seamless online experiences.",https://www.linkedin.com/company/uqontrol-inc-,"Consumer Electronics, Cyber Security, E-Commerce, Hardware, Internet of Things, Payments, Software",c_00011_00050,Western US,1/1/2014,active,Christopher Maus
uQuest,https://www.uquest.com,"Don't work, play.",https://www.linkedin.com/company/uquest-llc,"Advertising, Freelance",c_00011_00050,"East Coast, New England, Northeastern US",10/30/2017,active,David Wigemark
uQuote,https://uQuote3PL.com,uQuote helps brands optimize and manage their supply chain network.,https://www.linkedin.com/company/uquote-3pl,"E-Commerce, Logistics, Marketplace",c_00001_00010,"Greater Los Angeles Area, West Coast, Western US",1/1/2023,active,Josh Rothstein
uRoomates.com,http://uroommates.com,College Roommate Matching Service,,"Apps, Market Research, Private Social Networking, Social Media, Universities",c_00001_00010,"San Francisco Bay Area, West Coast, Western US",7/11/2011,active,"Stacy Phillippe, Trent Mervine"
uSERP,https://userp.io,High-authority link building and SEO for SaaS,https://www.linkedin.com/company/userp,"Advertising, Marketing, SEO",c_00011_00050,"Greater Denver Area, Western US",5/1/2019,active,"Brad Smith, Jeremy Moser"
uSTADIUM,http://ustadium.com,uSTADIUM is a rewards platform where sports fans create content and make predictions for points.,https://www.linkedin.com/company/ustadium/,"Apps, Social, Social Media, Sports",c_00001_00010,"Greater New York Area, East Coast, Northeastern US",9/14/2015,active,"Frankie Vittorini, Nick Spano, Sonny Trujillo"
uSave LED,https://www.usaveled.com,uSave LED is a manufacturer of commercial LED lighting products.,https://www.linkedin.com/company/usave-led,"Commercial, Lighting, Manufacturing",c_00011_00050,"Greater Miami Area, East Coast, Southern US",1/1/2012,active,
uSell,http://www.usell.com,uSell is a marketplace for used electronics that connects device sellers with buyers.,https://www.linkedin.com/company/usell.com/,"Consumer Electronics, E-Commerce, Marketplace, Mobile, Retail, Software",c_00051_00100,"Greater New York Area, East Coast, Northeastern US",11/18/2003,active,"Christian Croft, Daniel Brauser, Douglas Feirstein, Nik Raman"
uSens,https://en.usens.com,uSens develops inside-out hand and position tracking technology for augmented and virtual reality,https://www.linkedin.com/company/usens-inc-,"3D Technology, Artificial Intelligence (AI), Augmented Reality, Computer Vision, Human Computer Interaction, Machine Learning, Robotics, Software, Virtual Reality",c_00051_00100,"San Francisco Bay Area, Silicon Valley, West Coast, Western US",1/1/2013,active,"Anli He, Chris Shi, Yue Fei"
uShip,http://www.uship.com,"uShip is online transport marketplace primarily serving the freight, household goods, and vehicle shipping markets.",https://www.linkedin.com/company/uship,"Freight Service, Marketplace, Shipping",c_00101_00250,Southern US,6/1/2003,active,"Jay Manickam, Matt Chasen, Mickey Millsap"
uShow,http://www.ushow.com,uShow is a video recording application for iPhones.,https://www.linkedin.com/company/ushow,"Search Engine, Software, Video",c_00001_00010,"San Francisco Bay Area, Silicon Valley, West Coast, Western US",,active,
uShowcase.me,http://ushowcase.me,"Pioneering the future of career development, enablement, and research.",,"Artificial Intelligence (AI), Big Data, Internet",,"Greater Philadelphia Area, Great Lakes, Northeastern US",,active,T. Brad Kielinski
uSoftware,https://usoftware.co/,uSoftware is a software development partner that helps companies with the technology solution through outsourcing.,https://www.linkedin.com/company/united-software,"Outsourcing, Software, Software Engineering, Web Development",c_00251_00500,"Greater Philadelphia Area, East Coast, Southern US",9/19/2016,active,Oleksandr Chornyy
uStudio,https://ustudio.com,"uStudio is a cloud-based video platform that allows its users to integrate, manage, and deliver videos.",http://www.linkedin.com/company/ustudio,"Cloud Computing, Enterprise Software, PaaS, SaaS, Software, Video, Video on Demand, Video Streaming",c_00011_00050,Southern US,1/1/2010,active,"Alexander Mitchell, Jennifer Grogono, Josh Marshall"
uStudios,http://upublicstudios.com/,"uStudios is an advertising company that provides film production, editorial, and commercial and support services.",,"Advertising, Audio, Film Production, Media and Entertainment, Video Editing",c_00011_00050,Western US,,active,
uSys Integral,http://usysinc.com,μSys Integral provides technical advisory and consulting services within the fields of advanced electronics and power control systems.,,"Consulting, Electronics, Mechanical Engineering",,"San Francisco Bay Area, Silicon Valley, West Coast, Western US",1/1/1998,active,
uTaP,http://utapthat.com,uTap is a location-based social networking application that allows college students to message with each other.,,"Messaging, Social, Telecommunications",c_00001_00010,"Great Lakes, Midwestern US",1/1/2010,active,Karl Meves
uTapp,http://utappapp.com/,Group planning without group messaging.,https://www.linkedin.com/company/10560238,"Apps, Internet, Messaging, Mobile",c_00001_00010,"San Francisco Bay Area, West Coast, Western US",1/1/2015,active,"Oritsetimeyin Moju, Runar Guðbjartsson II"
uTax Software,https://utaxsoftware.com,"uTax Software provides tax software solutions & support, mobile app to tax professionals, and resellers.",https://www.linkedin.com/company/utax-software-llc,"Information Services, Information Technology, Marketing, Mobile Apps, Software",c_00011_00050,Southern US,1/1/2012,active,
uTaxes,https://www.utaxes.com,"uTaxes is a tax preparation, tax reviewing, and tax compliance company that offers services to startups and established companies.",https://www.linkedin.com/company/utaxes,"Accounting, Finance, Financial Services, Retail, Small and Medium Businesses",c_00011_00050,"East Coast, Northeastern US",1/1/1974,active,
uTest,https://www.utest.com,uTest connects community of digital freelance software testers.,https://www.linkedin.com/company/utest,"Freelance, Mobile Apps, Software",c_00501_01000,"Greater Boston Area, East Coast, New England, Northeastern US",1/1/2007,active,
uThanku,http://uthanku.com,Experience something positive each day,,"Android, Apps, Gift Card, iOS, Messaging, Mobile, Psychology, Social Media, Software",c_00001_00010,"San Francisco Bay Area, Silicon Valley, West Coast, Western US",1/1/2012,active,Aparna Ramanathan
uTopology,http://www.utopology.com/,"We specialize in enhancing success. We create transformation by advising in all things people, process, and culture.",https://www.linkedin.com/company/utopology,,,"Greater Phoenix Area, Western US",,active,
uTouchPOS,https://utouchpos.com/,"uTouchPOS Provides POS solutions for retail, restaurants & micro-merchants integrating software, hardware and merchant services.",https://www.linkedin.com/company/utouchpos/,"Computer, Software",c_00011_00050,"Greater Minneapolis-Saint Paul Area, Great Lakes, Midwestern US",,active,
uTranslated,http://www.utranslated.com,uTranslated offers an online platform that enables businesses and individuals to find and obtain services of translators.,https://www.linkedin.com/company/utranslated,"Consumer Reviews, Marketplace, Payments, Translation Service",c_00001_00010,"Great Lakes, Northeastern US",1/1/2015,active,"John Frazier, Lujing Gao"
uVision Partners,https://uvisionpartners.com,"uVision Partners is a business development company that offers web design, branding, and digital marketing services.",https://www.linkedin.com/company/uvisionpartnersweb,"Business Development, Digital Marketing, Marketing, Web Design, Web Development",c_00011_00050,"Greater Baltimore-Maryland Area, East Coast, Southern US",1/1/2017,active,
uVolunteer,https://www.uvolunteer.net/,"uVolunteer specializes in providing volunteer working vacations in Costa Rica, Ghana and Thailand.",https://www.linkedin.com/company/uvolunteer/,"Leisure, Tourism, Travel",c_00011_00050,"Greater Philadelphia Area, East Coast, Southern US",1/1/2007,active,
uVoxel,https://uvoxel.com,"uVoxel focuses on video production, graphic design, website design.",https://www.linkedin.com/company/uvoxel-llc/,"Graphic Design, Photography, SEO, Social Media Management",c_00001_00010,"Greater Houston Area, Southern US",1/1/2012,active,
uZoom,http://www.uzoom.me/,uZoom offers a geolocation-based mobile application that allows smartphone users to be virtually present anywhere in the world.,https://www.linkedin.com/company/uzoom-inc.,"Mobile Apps, Video, Video on Demand, Video Streaming, Wireless",c_00011_00050,"Greater Seattle Area, West Coast, Western US",1/1/2016,active,"Dean Graziano, Martin Rincon"
uaXport,https://uaxport.com/,uaXport is a cross border food distributor.,,"Food and Beverage, Food Delivery",,"Greater New York Area, East Coast, Northeastern US",,active,
uammi,https://www.uammi.org,"uammi brings public, private, community, industry, and education partners together to Utah’s advanced material and manufacturing industry.",https://www.linkedin.com/company/uammi,"Industrial, Manufacturing, Non Profit",c_00001_00010,Western US,1/1/2014,active,
ubair,http://www.ubair.com,Everything you’ll ever need to book your private flight right there in the palm of your hand.,https://www.linkedin.com/company/ubair-llc,"Apps, Customer Service, Ticketing, Travel",c_00001_00010,"Greater Boston Area, East Coast, New England, Northeastern US",2/1/2015,active,
uberliss,http://uberliss.com,Uberliss is a personal care product manufacturing company that offers products including Keratin Treatment and Bond Treatment.,https://www.linkedin.com/company/-uberliss,"Beauty, Health Care, Manufacturing, Personal Development",c_00011_00050,"Greater Chicago Area, Great Lakes, Midwestern US",1/1/2013,active,
ubimodo inc.,http://ubimodo.com,Personal safety,https://www.linkedin.com/company/ubimodo,,c_00001_00010,"West Coast, Western US",1/1/2014,active,
uchannel,https://www.uchanneltv.us/,Excellent TV channel live broadcasts,,Media and Entertainment,,"San Francisco Bay Area, Silicon Valley, West Coast, Western US",,active,
uchic,http://uchic.com/,"Charitable fashion, for & by young women",http://www.linkedin.com/company/u-chic-media,"Fashion, Publishing, Women's",c_00011_00050,"Washington DC Metro Area, Southern US",1/1/2013,active,Christie Garton
udeForex,http://www.udeforex.com/,"udeforex is a trading  that specializes in trading, market research and financial services.",,"Financial Services, Marketing, Trading Platform",c_00001_00010,"Greater New York Area, East Coast, Northeastern US",1/1/2008,active,
udelv,https://www.udelv.com/,udelv enables the growth of commerce by automating delivery.,https://www.linkedin.com/company/udelv/,Autonomous Vehicles,c_00001_00010,"San Francisco Bay Area, West Coast, Western US",1/1/2016,active,"Akshat Patel, Daniel Laury"
udictio,https://udictio.com,social and interactive dictionary.,https://www.linkedin.com/company/udictio,Social Media,c_00001_00010,Western US,5/1/2020,active,Aras Diler
udu,http://www.udu.co/,"Deal Sourcing at Machine Speed and Coverage, with a Human Touch",https://www.linkedin.com/company/udu-inc,"Information Services, Information Technology, Software",c_00001_00010,"Research Triangle, East Coast, Southern US",1/1/2013,active,"Andy Kell, Charles Shook, Rett Crocker"
ue.co,https://ue.co/,Crafting Industry-Leading Enterprise Sales Software,https://www.linkedin.com/company/ue.co,"Digital Marketing, Insurance, Lead Generation, Software",c_00051_00100,"Greater San Diego Area, West Coast, Western US",1/1/2008,active,"Jason Kulpa, Taryn Lomas"
uforia studios,http://uforiastudios.com,Uforia studios is a fitness centre specialising in group exercise classes.,https://www.linkedin.com/company/uforia-studios,"Fitness, Health Care, Sports",c_00101_00250,"San Francisco Bay Area, West Coast, Western US",2/1/2011,active,
uhRohMuh,https://uhrohmuh.com,uhRohMuh manufactures and sells organic beauty products and accessories.,https://www.linkedin.com/company/uhrohmuh,"Beauty, E-Commerce, Manufacturing",c_00001_00010,"Washington DC Metro Area, East Coast, Southern US",1/1/2017,active,
uiAgent,https://uiagent.co,Large Action Models for Business Process Automation,https://www.linkedin.com/company/uiagent/,Generative AI,c_00001_00010,"Greater New York Area, East Coast, Northeastern US",8/1/2024,active,Enes Witwit
uipathtek,https://uipathtek.com,uipathtek provides business intelligence solutions and information technology services.,https://www.linkedin.com/company/uipathtek,"Digital Marketing, Graphic Design, Information Technology, UX Design",c_00011_00050,"East Coast, Southern US",,active,
ujet.cx,https://ujet.cx,ujet.cx is a cloud contact center platform specializing in business process outsourcing solutions.,https://www.linkedin.com/company/18051573,"Cloud Data Services, Communications Infrastructure, Customer Service, Information Technology, Small and Medium Businesses",c_00101_00250,"San Francisco Bay Area, West Coast, Western US",1/1/2015,active,"Anand Janefalkar, Hisun Kim"
uknowa,http://www.uknowa.com,Uknowa is a freelance site where people can post jobs and others can bid and complete awarded jobs.,https://www.linkedin.com/company/uknowa,"Home Renovation, Landscaping, Online Auctions, Professional Services",c_00001_00010,Great Lakes,1/1/2009,active,
ulcommerce,http://www.ulcommerce.com,"Software ecommerce, ulcommerce is used by companies that factural year between US $ 50M - US $ 200M.",https://www.linkedin.com/company/ulcommerce,"E-Commerce, Enterprise Software, Software",c_00011_00050,"San Francisco Bay Area, Silicon Valley, West Coast, Western US",1/1/2012,active,Oscar Pulido
ulink,http://www.ulinkx.com,"uLinkx offers a platform that enables its users to access videos which are categorized according to news, sports, music, and movies.",,"Music, Search Engine, Social Media, Video",c_00011_00050,"San Francisco Bay Area, Silicon Valley, West Coast, Western US",,active,
ultapay.com,http://www.ultapay.com,Ultapay allows credit and debit cardholders to give out a card that is connected to their account and control how it is used.,,"E-Commerce, FinTech, Payments",c_00011_00050,"San Francisco Bay Area, Silicon Valley, West Coast, Western US",1/1/2012,active,"George Sibble, Kristal Bergfield, Leonardo Shapiro"
ultimumIT,https://www.ultimumit.com,ultimumIT is an independent IT Services company that specializes in delivering technology solutions to meet the needs of clients.,https://www.linkedin.com/company/ultimumit/,"Computer, Information Technology",c_00001_00010,"Greater Los Angeles Area, West Coast, Western US",1/1/2012,active,
ulu LAGOON,https://ululagoon.com,"ulu LAGOON is an online store that offers air fresheners, candles, pillow, and accessories.",https://www.linkedin.com/company/ulu-lagoon,E-Commerce,c_00001_00010,"East Coast, Southern US",1/1/2013,active,
umeLife,http://umedrive.com/,USB Embedded Bracelet | Waterproof | Customizable,,"Digital Media, Social Media, Social Network",c_00001_00010,"Greater New York Area, East Coast, Northeastern US",,active,"Clem Harrigan, Daizy Harrigan"
umebooks,http://umebooks.com,umebooks offers an online platform that enables its users to publish and read contents.,,Publishing,c_00001_00010,"East Coast, Southern US",1/1/2012,active,mike morriss
umpire,https://umpiremitigation.com/,Umpire offers instant booking and flat rates with big savings.,https://www.linkedin.com/company/umpiremitigation/,"Financial Services, Insurance",c_00001_00010,"Washington DC Metro Area, East Coast, Southern US",10/16/2017,active,
un/common,http://uncommon.us,"un/common is an advertising agency that offers graphic design, branding, marketing strategy, and print services.",https://www.linkedin.com/company/un-common,"Advertising, Brand Marketing, Content Creators, Digital Marketing, Graphic Design, Social Media Management, UX Design",c_00011_00050,"West Coast, Western US",1/1/2016,active,
unCommon Thread,https://www.uncommonthread.biz,"unCommon Thread is an eCommerce platform that offers business directory, marketplace platforms, and marketplace opportunities.",https://www.linkedin.com/company/uncommon-thread,"E-Commerce Platforms, Information Technology, Marketplace",c_00011_00050,Great Lakes,1/1/2007,active,
unKlaimed,https://unklaimed.com/,"Unklaimed is a company that specializes in helping individuals and businesses recover assets that have been deemed ""unclaimed"".",https://www.linkedin.com/company/unklaimed/,"Asset Management, Banking, Finance, Financial Services",c_00001_00010,"Greater Los Angeles Area, West Coast, Western US",1/25/2023,active,"Denis Esipenko, Enrik Balish, Maks Pundyk"
unLOCKEd,https://unlockedcompany.com,"unLOCKEd is a marketing and branding agency offering content marketing, social media marketing, SEO, web design, and digital marketing.",https://www.linkedin.com/company/unlocked-company,"Content Marketing, Digital Marketing, Information Technology, SEM, SEO, Social Media Marketing, Web Design",c_00001_00010,Great Lakes,1/1/2014,active,
unPLUG Dining,https://unplugdining.com/,unPLUG is a restaurant and hospitality technology that provides orders and pay solutions.,https://www.linkedin.com/company/unplug-dining-inc,,c_00011_00050,"Greater Chicago Area, Great Lakes, Midwestern US",1/1/2020,active,"Ali Bolak, Colton Frank"
unPlatforms,https://www.unplatforms.com,Enabling knowledge marketplaces via no code,https://www.linkedin.com/company/unplatforms,,c_00001_00010,"Dallas/Fort Worth Metroplex, Southern US",10/15/2021,active,"Kalyan Kommineni, Vasudha Nannapaneni"
"unSkript, Inc",https://unskript.com/,"An Open, Interactive and Intelligent Cloud Ops Automation Platform",https://www.linkedin.com/company/unskript-inc/,"Artificial Intelligence (AI), Cloud Management, DevOps",c_00011_00050,"San Francisco Bay Area, Silicon Valley, West Coast, Western US",1/1/2020,active,Abhishek Saxena
unWine'd,https://www.experienceunwined.ca/,unWine'd is engaged in the recycling of vineyards and production of relaxation products such as skincare and handcrafted vine products.,,"Cosmetics, Manufacturing, Tea, Winery",c_00011_00050,Great Lakes,,active,
unWired Broadband,https://www.getunwired.com,UnWired Broadband connects the fast and reliable Internet to residential and business customers.,https://www.linkedin.com/company/unwired-broadband/,"Data Center, Internet, Telecommunications",c_00101_00250,"West Coast, Western US",1/1/2003,active,
unboXt,https://getunboxt.com/,"unboXt is a data analytics company that helps leadership understand if, when and why an employee will leave their current team.",https://www.linkedin.com/company/unboxt-inc,"Human Resources, Software",c_00001_00010,"Greater Atlanta Area, East Coast, Southern US",1/1/2018,active,"Hakeem Isaac, Kendra Ward"
uncommn,https://getuncommn.com/,Uncommon is an online customization business for Apple hardware accessories.,https://in.linkedin.com/company/uncommon,"Consumer, Consumer Electronics, E-Commerce, Electronics, Mobile, Product Design",c_00011_00050,"East Coast, Southern US",1/1/2009,active,
uncouth,https://uncouthskincare.co.uk,uncouth is An virtual dermatology service that provides you with access to skin doctors and customized healthcare!,https://www.linkedin.com/company/uncouth,"Cosmetics, Health Care, Personal Health",c_00001_00010,"East Coast, Northeastern US",3/1/2023,active,
