name,website,short_description,linkedin,categories,num_employees_enum,locations,founded_on,operating_status,founders
wingo,https://www.wingo.com,wingo operates in the Vaccines and other Immunizing Products.,https://www.linkedin.com/company/wingoairlines,"Health Care, Medical, Medical Device",c_00011_00050,"East Coast, Southern US",1/1/1992,active,
wintranslation,http://www.wintranslation.com,Award-winning translation company,http://www.linkedin.com/company/wintranslation,"Enterprise Software, Local, Translation Service",c_00011_00050,Great Lakes,1/1/1998,active,
wiseGEEK,http://www.wisegeek.com/,wiseGEEK is an online archive of common questions and answers that covers diverse categories.,,Internet,c_00001_00010,Western US,1/1/2003,active,Denis Grosz
wiseOutlook,https://www.wiseoutlook.com,wiseOutlook is an Information Technology Company that provides a variety of services and solutions for both the public and private sectors.,,"Information Technology, Project Management, Software",c_00011_00050,"East Coast, Southern US",1/1/2015,active,
wisewords.co,http://wisewords.co,Wisewords provides on-demand career advice from industry experts to help you get your dream job faster.,http://www.linkedin.com/company/957186,Advice,c_00001_00010,Great Lakes,9/1/2013,active,Dawson Whitfield
wishTabs,http://www.wishTabs.com,wishTabs lists out various products and enable instant sharing options with friends through social media networks.,,,c_00001_00010,"Greater New York Area, East Coast, Northeastern US",4/14/2012,active,
withSimplicity,https://withsimplicitybeauty.com,"withSimplicity crafts natural, organic skincare and makeup products, focusing on clean, cruelty-free ingredients.",https://www.linkedin.com/company/withsimplicity,"Beauty, Consumer Goods, E-Commerce, Organic, Wellness",c_00001_00010,"East Coast, Southern US",1/1/2015,active,Irina Dovganetskiy
withco,https://with.co/,withco is a provider of real estate and technology services to small businesses.,https://www.linkedin.com/company/withco/,"Internet, Real Estate, Small and Medium Businesses",c_00001_00010,"Greater New York Area, East Coast, Northeastern US",1/1/2019,active,Kevin Song
"wm+a, AlphaBee",https://wmanda.com/,"wm+a, AlphaBee offers person-directed planning, clinical care, accountability, training, consulting, and specialized behavioral services.",https://www.linkedin.com/company/wm-a-alphabee/,"Health Care, Hospital, Medical, Training",c_00101_00250,Great Lakes,1/1/1999,active,Dunya Marijan
wmHarper,https://www.wmharper.com/,"WMH is a strategically-led, creatively driven, transformation agency that focuses on helping brands transition.",https://www.linkedin.com/company/wmharper/,"Advertising, Brand Marketing, Marketing",c_00011_00050,"Research Triangle, East Coast, Southern US",1/1/2015,active,
wmcws,https://wmcws.com,"wmcws is a webhosting company that offers services such as wordpress hosting, email hosting, cloud hosting, and object storage hosting.",,"Cloud Computing, Cloud Storage, Private Cloud, Web Development, Web Hosting",c_00001_00010,"Greater Atlanta Area, East Coast, Southern US",2/10/2022,active,Dylan Perotti
wndr,http://www.justwndr.com,We help travelers book hotels directly from their favorite content creators without leaving socials.,https://www.linkedin.com/in/mickey-haslavsky-8320a942/,"Consumer, Content Creators, Content Discovery, Travel",c_00011_00050,"Greater New York Area, East Coast, Northeastern US",1/1/2019,active,"Mickey Hasalvsky, Oran Epelbaum"
wolf home design,http://info.wolfhomedesign.com,Wolf Home Design is an interior design and project management firm.,https://www.linkedin.com/company/wolf-home-design,,c_00011_00050,"Greater Chicago Area, Great Lakes, Midwestern US",1/1/2012,active,
wolfSSL Inc.,https://www.wolfssl.com,wolfSSL is an open source TLS library.,https://www.linkedin.com/company/wolfssl,"Cloud Computing, Security",c_00011_00050,Western US,1/1/2004,active,"Larry Stefonic, Todd Ouska"
wolfgang puck coffee,https://www.wpcoffee.com,wolfgang puck coffee is a retailer of coffee products for business and food service.,https://www.linkedin.com/company/wolfgang-puck-coffee,,c_00011_00050,"Greater Seattle Area, West Coast, Western US",,active,Richard Stoulil
womenandtravel.net,https://womenandtravel.net/,Wesite- Travel,,Travel,c_00001_00010,"San Francisco Bay Area, West Coast, Western US",,active,
wonderMakr,https://www.wondermakr.com/,wonderMakr is a creative technology agency that engineers and develops innovative digital + live experiences for consumers.,https://www.linkedin.com/company/wondermakr,"Creative Agency, Social Network",c_00011_00050,Great Lakes,1/1/2013,active,
wonderful,https://wunderfy.com,wonderful is a website design and marketing company.,https://www.linkedin.com/company/wunderfy-studios/,"Advertising, Business Development, Marketing, SEO, Web Design, Web Development",c_00001_00010,"East Coast, Southern US",1/1/2015,active,
wonders,http://wonders.co/,wonders specializes in combining technology and entertainment to create things.,https://www.linkedin.com/company/wonder-co,"Content, Product Design, Software, Video, Video Streaming",c_00011_00050,Southern US,,active,
wondertouch,http://www.wondertouch.com,Particle Graphics Effects,https://www.linkedin.com/company/i-am-currently-networking,,c_00001_00010,Midwestern US,6/1/2002,active,
wongsang Worldwide,http://www.wongsangworldwide.com/,Wongsang Worldwide provides digital marketing services for businesses to increase their sales productivity and other performances.,,"Advertising, Digital Marketing",c_00011_00050,"Greater New York Area, East Coast, Northeastern US",7/23/2003,active,
woodpellets.com,http://www.woodpellets.com,Wood pellet.com offers online ordering of wood pellets directly to homes through a network of manufacturing sources.,https://www.linkedin.com/company/woodpellets-com,"Biomass Energy, CleanTech, E-Commerce, Manufacturing",c_00011_00050,"East Coast, New England, Northeastern US",1/1/2006,active,Jonathan Strimling
woods coffee,https://woodscoffee.com/,woods coffee is a food & beverages company.,https://www.linkedin.com/company/woods-coffee/,,,"West Coast, Western US",1/1/2002,active,
woodswholesalewine,http://www.woodswholesalewine.com,"Shop online best red wine, Champagne, Rare Spirits, Rare Beers from Woodswholesalewine .",,"E-Commerce, Retail, Wine And Spirits",c_00001_00010,Southern US,1/1/1957,active,
wool.and,https://wooland.com/,"Our aim is to design the most practical, most wearable dress in your wardrobe.",,,,"West Coast, Western US",1/1/2018,active,
woother.com,https://www.woother.com ,woother.com is an online marketplace for wooden products.,,"Consumer Goods, E-Commerce, E-Commerce Platforms, Marketplace, Online Portals, Shopping",c_00001_00010,"Greater Miami Area, East Coast, Southern US",,active,
woozik,https://www.woozik.com,Woozik delivers the industry leading quality audio equipment including Headphones & Speakers at an affordable price.,https://www.linkedin.com/company/woozik,"Computer, Consumer Electronics, E-Commerce, Manufacturing, Music",c_00011_00050,"Greater New York Area, East Coast, Northeastern US",1/1/2014,active,
wordZXpressed Transcription Services,http://wordzx.com,wordZXpressed Transcription Services is a hospital & health care company that offers medical transcription services.,https://www.linkedin.com/company/156587,"Health Care, Medical",c_00251_00500,"Greater Atlanta Area, East Coast, Southern US",1/1/1993,active,
wordatom,https://wordatom.com/,We are very dedicated at providing readers with quality tips and tricks about WordPress. We also guide on how to create a website and blog.,,"News, Publishing",,Southern US,1/1/2017,active,
wordnik,https://www.wordnik.com/,Wordnik is a nonprofit organization that finds and shares English words with people.,https://www.linkedin.com/company/hollywood-digital-online,"Association, Communities, Education, Language Learning",c_00001_00010,"Greater New York Area, East Coast, Northeastern US",6/1/2009,active,"Erin McKean, John McGrath"
work x work,https://workxwork.com,"work x work provides storytelling, even, and design services.",https://www.linkedin.com/company/work-x-work,"Advertising, Brand Marketing, Events, Lighting",c_00001_00010,"Greater New York Area, East Coast, Northeastern US",1/1/2016,active,Scott Newman
work-flow.biz,http://www.work-flow.biz,Web based project management/workflow,,"Collaboration, Enterprise Software, Project Management, Software",c_00001_00010,"Greater Detroit Area, Great Lakes, Midwestern US",11/1/2008,active,Andrew Koper
workMETHODS Solutions Inc,http://www.workmethods.com/,workMETHODS is a global software and IT consulting services company.,https://www.linkedin.com/company/workmethods-inc./?originalSubdomain=in,"CRM, Information Technology, Software",c_00101_00250,"Washington DC Metro Area, East Coast, Southern US",1/1/1999,active,
workXid,https://www.workxid.com/,workXid provides a cloud-based portable identity and credentialing system that is designed for all industries.,https://www.linkedin.com/company/cyberassist-inc-ca-/,"Identity Management, Information Technology, Network Security, Software",c_00001_00010,Great Lakes,1/1/2013,active,
workability,http://www.workability.one,Internet Job Board www.workability.one connects inclusive employers with qualified neurodiverse and disabled job seekers and talent.,https://www.linkedin.com/company/workabilityone,"Employment, Internet, Professional Services",c_00001_00010,"West Coast, Western US",5/1/2021,active,Sheila Jordan
worknews.io,https://worknews.io/,worknews.io designs and develops tools for aggregating news and learning new information.,https://www.linkedin.com/company/worknews/,"Information Technology, News, Software",c_00001_00010,"Greater New York Area, East Coast, Northeastern US",1/1/2014,active,Troy Benton
workpays.me,http://www.workpays.me,"Workpays Ltd is a compoany that provides consultancy, project management and training to employess.",http://www.linkedin.com/company/workpays-me,"E-Commerce, Finance, FinTech",c_00011_00050,"Greater Philadelphia Area, Great Lakes, Northeastern US",4/17/2012,active,"Jonathan Dorfman, Josh Verne"
workplace,https://workplacestaffing.com/,"workplace is a staffing agency that hires candidates and employers for manufacturing, administrative support, and executive positions.",https://www.linkedin.com/company/workplace/,"Human Resources, Professional Services, Recruiting, Staffing Agency",c_00011_00050,"Great Lakes, Midwestern US",1/1/1988,active,LoRayne Logan
worksheetworks.com,http://www.worksheetworks.com,Worksheetworks.com is a provider of elementary-school-level worksheets covering a wide variety of topics.,,Education,c_00001_00010,"San Francisco Bay Area, West Coast, Western US",1/1/2005,active,
worksmART,https://www.worksmartadvantage.com/,worksmART is a professional training provider that offers various programs and workshops for team and leadership development.,https://www.linkedin.com/company/worksmartadvantage/,"Consulting, Corporate Training, Training",c_00001_00010,"Greater Los Angeles Area, West Coast, Western US",,active,
workstrat,https://www.workstrat.co/,workstrat provides business consulting and coaching services.,https://www.linkedin.com/company/workstrat,"Consulting, Human Resources, Recruiting",c_00001_00010,"Greater Philadelphia Area, Great Lakes, Northeastern US",1/1/2022,active,
worldAWAKE,http://www.worldawake.com,"worldAWAKE offers assessments, leadership coaching, and team performance coaching.",https://www.linkedin.com/company/worldawake-inc-,"Consulting, Professional Services",c_00001_00010,"West Coast, Western US",1/1/2005,active,
worldento,http://worldento.com/,worldento,,,c_00001_00010,Southern US,,active,
worldmicroblading,https://worldmicroblading.com/microblading-academy-usa/,"cosmetic, permanent makeup, training, cosmetoclogy",,"E-Commerce, Education",c_00251_00500,"Greater Los Angeles Area, West Coast, Western US",2/2/1987,active,
worldnewsartist,https://world-news-media.medium.com,Play biographies of music artists and singers,,Music,c_00001_00010,"San Francisco Bay Area, West Coast, Western US",4/13/2022,active,
worldwideRiches Web Design and SEO,https://www.worldwideriches.com,Helping companies grow revenues with proven digital marketing techniques including SEO and high-converting website design .,https://www.linkedin.com/company/worldwideriches/,,c_00001_00010,"Greater New York Area, East Coast, Northeastern US",1/1/1996,active,Rich Stivala
wowbrands,http://www.wowbrands.com,"wowbrands is a full-service strategy, design, marketing, and technology agency.",https://www.linkedin.com/company/wowbrands,"Advertising, Brand Marketing, Information Technology, Marketing, SEO",c_00011_00050,"Great Lakes, Midwestern US",1/1/2009,active,Andrew Catapano
wpDuo,https://wpduo.com ,wpDuo provides is a WordPress Website Management And Design Company.,https://www.linkedin.com/company/wpduo ,"Advertising, Graphic Design, Information Technology, Web Design",c_00001_00010,"Great Lakes, Midwestern US",1/1/2010,active,Laura Benjamin
wpONcall,https://wponcall.com/,wpONcall provides security and unlimited support to protect and improve the website.,https://www.linkedin.com/company/wponcall-wordpress-website-maintenance/,"Internet, Telecommunications",c_00011_00050,"San Francisco Bay Area, West Coast, Western US",1/1/2012,active,Kevin Gallagher
wpXtreme,http://wpxtre.me,Your extreme toolbox for WordPress,https://www.linkedin.com/company/wpxtreme,"Blogging Platforms, Browser Extensions, Cloud Computing, Software",c_00001_00010,"Greater Boston Area, East Coast, New England, Northeastern US",8/1/2012,active,"Giovambattista Fazioli, Matteo Fantuzzi, Nicola Ballotta, Stefano Furiosi"
wpZilla,https://wpzilla.com,"wpZilla specialized in simple and fun WordPress hosting for personal, business, or school websites.",,"Internet, Web Hosting",,"Tampa Bay Area, East Coast, Southern US",,active,
wrITe Groupz,http://writegroupz.com,wrITe Groupz is a content management solutions provide organizations.,https://www.linkedin.com/in/write-groupz-44794220a,"Industrial Engineering, Information Technology, Outsourcing, Professional Services, Software",c_00101_00250,"Greater Houston Area, Southern US",,active,
wrapeez,https://www.wrapeez.com,Wrapeez creates reusable fabric gift bags & stretch wraps that require no tape & scissors. Say yes to eco-friendly & fashionable Wrapeez!,https://www.linkedin.com/company/wrapeez/,"E-Commerce, Fashion, Product Design, Retail",c_00001_00010,"Greater Philadelphia Area, Great Lakes, Northeastern US",1/1/2012,active,"Jodi Kahane, Stephanie Grabell"
wrinkle free delivery,https://wrinklefreedelivery.com ,wrinkle free delivery is a On-Demand Laundry & Dry Cleaning Delivery Service sending clothes for dry cleaning or laundering.,,"Consumer, Delivery, Laundry and Dry-cleaning",c_00001_00010,"Greater Atlanta Area, East Coast, Southern US",1/1/2016,active,James W. Barnett
wrk nil,https://wrknil.com,"wrk nil connects student athletes with brands, fans, and businesses to monetize their name, image, and likeness (NIL).",https://www.linkedin.com/company/wrk-nil,"Apps, Mobile Apps, Professional Networking",c_00001_00010,"West Coast, Western US",1/1/2020,active,
wrkbench.io,http://wrkbench.io,The world's first idea construction platform.,https://www.linkedin.com/in/arjunrai,"Apps, Enterprise Software, Project Management, Public Relations, SaaS, Software",c_00011_00050,"Greater New York Area, East Coast, Northeastern US",1/1/2013,active,Arjun Rai
wrkman,https://www.wrkmanapp.com,wrkman home service platform that connects our users with skilled and accountable service providers or artisans in Africa and beyond.,https://www.linkedin.com/company/wrkmanhq/,"Home Services, Information Technology, Professional Services, Service Industry",c_00001_00010,"Greater Minneapolis-Saint Paul Area, Great Lakes, Midwestern US",1/5/2022,active,Babatunde Ebohon
wrong side of the pond Creative,https://wsotpcreative.com,wrong side of the pond Creative is a branding and marketing agency that provides web design and consulting services.,https://www.linkedin.com/company/wsotpcreative,"Consulting, Digital Marketing, Graphic Design, Web Design",c_00001_00010,"Great Lakes, Midwestern US",1/1/2021,active,
wtg marketing,https://www.wtg.io/,"wtg Marketing is a digital marketing agency that specializes in SEO, SEM, Web Development, Email Marketing, and Content Creation.",,"Advertising, Consulting, Email, Marketing",,"Great Lakes, Midwestern US",,active,
wugo,https://www.wugo.app,"Wugo, a mobile app, reinvents local social life by connecting users to events and activities in their area, fostering community engagement.",https://www.linkedin.com/company/wugoglobal,"Event Management, Event Promotion, Events",c_00001_00010,"Greater Los Angeles Area, West Coast, Western US",11/1/2022,active,
wumo,http://wumo.com,Wumo is an international entertainment company focused on developing cross-media comedy products.,,"Digital Entertainment, Media and Entertainment, Social",c_00001_00010,"Washington DC Metro Area, Southern US",1/1/2000,active,Morten E. Wulff
wwMasMedia LLC,http://wwmasmedia.com,digital marketing ,,"Advertising, Internet, Marketing, Mobile Apps",c_00011_00050,"Greater Miami Area, East Coast, Southern US",1/20/2015,active,
www.caddesignhelp.com,https://www.caddesignhelp.com,"3D CAD, 3D modeling, product design, 3d printing, inventions, patents, product development",https://www.linkedin.com/in/scott-tarcy-a52b138/,"Manufacturing, Mechanical Engineering, Product Design",c_00001_00010,"East Coast, Southern US",10/1/2015,active,Scott Tarcy
wyDay,https://wyday.com,wyDay designs & provides premium software development tools for high-tech companies.,,"Information Services, Information Technology, Software",c_00011_00050,"Greater Boston Area, East Coast, New England, Northeastern US",,active,
wydraTEK LLC,https://www.wydratek.com/,wydraTEK LLC offers Small Business IT Consulting & Cloud Services in the Southern New Hampshire area.,http://www.linkedin.com/company/2471550,"Cloud Computing, Web Design, Web Development",c_00001_00010,"East Coast, New England, Northeastern US",1/1/2008,active,
wynwood tech,https://wynwood-tech.com,"wynwood tech is the global leader in Adobe Experience Cloud staffing. Adobe Experience Manager / Adobe AEM, Adobe Commerce + more.",https://www.linkedin.com/company/wynwoodtech,"Consulting, Digital Marketing, E-Commerce, Information Technology, Marketing, Recruiting, Staffing Agency, Web Development",c_00051_00100,"Greater Miami Area, East Coast, Southern US",2/1/2010,active,Manuel Marz
x-Pollinate,https://www.x-pollinate.com/,x-Pollinate provides creative solutions for unique opportunities.,https://www.linkedin.com/company/x-pollinate/,"Advice, Art, Consulting",c_00001_00010,Great Lakes,1/1/2014,active,
x-SITE-d Studio,https://x-site-d.com,"x-SITE-d Studio is an IT agency that offers web services, print design services, and social media management to small-size businesses.",,"Graphic Design, Information Technology, Printing, SEO, Small and Medium Businesses, Social Media Management, Web Design, Web Development",c_00011_00050,"Dallas/Fort Worth Metroplex, Southern US",1/1/1997,active,
x-Sentience,https://www.x-sentience.com/,x-Sentience Artificial Intelligence | Practical insights and solutions for the new world.,https://www.linkedin.com/company/x-sentience/about/,"Artificial Intelligence (AI), Software",c_00001_00010,"Greater Boston Area, East Coast, New England, Northeastern US",,active,
x.radius,http://www.xradius.com,"x.radius specializes in computer upgrades, network design, cloud, software, and application development services.",,"Information Technology, Software, Web Development, Web Hosting",c_00011_00050,Western US,,active,
x10industries,https://x10i.com/,"x10industries provides social web design, reputation management, online advertising, social media marketing, and search engine optimization.",https://www.linkedin.com/company/x10industries/,"SEO, Social Media Marketing, Web Design, Web Development",c_00001_00010,Southern US,1/1/2010,active,
x2o Studio,https://www.x2ostudio.com,Boutique Pilates Studio Brand,https://www.linkedin.com/company/x2o-studio,Fitness,c_00011_00050,"San Francisco Bay Area, Silicon Valley, West Coast, Western US",1/1/2019,active,Dexter Hart
x2x Exommerce,http://x2x-ecommerce.com/,x2x Ecommerce is an Omni channel solution that enables its users manage their e-commerce stores from Microsoft Dynamics GP.,https://www.linkedin.com/company/x2x-ecommerce,"E-Commerce, Information Technology",,Great Lakes,,active,
x8 Data Company,http://www.x8data.com,"B2B Contact Verification, Custom Data Services",https://www.linkedin.com/company/x8-data-company,"Big Data, Information Technology, Software",c_00001_00010,Southern US,1/1/2011,active,Hank Weghorst
xAI,https://x.ai,XAI is an AI company that develops a platform to accelerate human scientific discovery.,https://www.linkedin.com/company/xai,"Artificial Intelligence (AI), Generative AI, Information Technology, Machine Learning",c_00011_00050,"San Francisco Bay Area, West Coast, Western US",7/12/2023,active,"Christian Szegedy, Elon Musk, Kyle Kosic, Manuel Kroiss, Toby Pohlen"
xAmplifier,https://www.xamplifier.com/,"xAmplifier is a software to help you drive improved customer experiences, increase referrals, sales conversions and build digital audiences.",https://www.linkedin.com/company/xamplifier/,"Market Research, Marketing Automation, Reputation, SaaS, Software",c_00011_00050,"Greater Chicago Area, Great Lakes, Midwestern US",1/1/2012,active,James Kropp
xAmplify,https://www.xamplify.com,xAmplify is a channel marketing automation platform for partners and brands.,https://www.linkedin.com/company/xamplify/,"Information Technology, Marketing, Sales Automation, Software",c_00011_00050,"San Francisco Bay Area, Silicon Valley, West Coast, Western US",1/1/2018,active,
xAssets,http://www.xassets.com,"xAssets provides secure and scalable asset management software solutions, covering IT asset management and fixed asset management.",https://www.linkedin.com/company/xassets-north-america,"Asset Management, Information Technology, Software",c_00051_00100,"Greater Philadelphia Area, East Coast, Southern US",9/1/2001,active,Paul Lambert
xBiologix,https://www.xbiologix.com/,xBiologix lets clinicians and researchers easily visualize fully profiled tumors using simple immunofluorescent staining protocols.,https://www.linkedin.com/company/xbiologix/,"Biotechnology, Health Care, Health Diagnostics",c_00011_00050,"West Coast, Western US",1/1/2016,active,
xBit,https://xbitdcm.com,xBit has developed continuously to improve the process and management of case data for the examiner.,,Software,c_00011_00050,"East Coast, New England, Northeastern US",,active,
xBloom,https://xbloom.com/,xBloom's mission is to let everyone easily enjoy specialty coffee at home and truly connect roasters and consumers through the marketplace,https://www.linkedin.com/company/xbloom/,"Coffee, Consumer Applications, Hardware",c_00011_00050,"San Francisco Bay Area, West Coast, Western US",1/1/2021,active,
xBrain,http://xbrain.ai/,AI solutions to transcend customer experience,https://www.linkedin.com/company/xbrain,"Artificial Intelligence (AI), Customer Service, Information Technology, Software",c_00011_00050,"San Francisco Bay Area, West Coast, Western US",7/1/2012,active,Gregory Renard
xBuzz,https://xbuzzapp.com/,xBuzz is an app that helps users to create healthy savings habits.,https://www.linkedin.com/company/xbuzz,"Apps, Health Care, Software",c_00001_00010,"Greater Denver Area, Western US",9/1/2017,active,
xByte Technologies,https://www.xbyte.com,xByte Technologies to provide high quality IT equipment with first-class customer service.,https://www.linkedin.com/company/xbyte-technologies,"Computer, Hardware, Information Technology, Software",c_00051_00100,"East Coast, Southern US",1/1/2001,active,Tom Santilli
xCell Strategic Consulting,https://xcellstrategicconsulting.com/,"xCell Strategic Consulting is a consultancy that provides drug development, outsourcing, and supply chain reliability services.",https://www.linkedin.com/company/xcellstrategicconsulting/,"Compliance, Consulting, Outsourcing, Supply Chain Management",c_00011_00050,"Greater Philadelphia Area, Great Lakes, Northeastern US",1/1/2013,active,
xChange Automotive,http://xchangeautos.com,xChange Automotive is a web-based online marketplace for auto dealers to sell or finance cars.,http://www.linkedin.com/company/2562067,"Automotive, E-Commerce, Internet, Marketplace, Online Portals",c_00001_00010,"East Coast, Southern US",3/1/2010,active,
xCraft Enterprises,http://xcraft.io,"xCraft develops small, powerful flying machines that change the world.",,"Manufacturing, Robotics",c_00011_00050,Western US,11/1/2013,active,"Charles Manning, JD Claridge"
xCures,https://xcures.com,xCures is an AI-based precision oncology platform that tightly integrates cancer research and care.,https://www.linkedin.com/company/xcures/,"Artificial Intelligence (AI), Biotechnology, Health Care, Machine Learning, Medical, Oncology, Pharmaceutical",c_00051_00100,"San Francisco Bay Area, West Coast, Western US",2/1/2018,active,"Jeff Shrager, Marty Tenenbaum"
xDai,https://www.xdaichain.com/,XDai is a cybersecurity company that specializes in providing stable payments in the blockchain industry.,,Security,c_00001_00010,"San Francisco Bay Area, Silicon Valley, West Coast, Western US",10/1/2018,active,Igor Barinov
xDrones,http://www.xdrones.com/,xDrones is a drone manufacturing company.,,"Drones, Manufacturing",c_00011_00050,"Greater Los Angeles Area, West Coast, Western US",,active,
xInsights,https://xInsights.io,SaaS,,"Analytics, Big Data, Business Intelligence, Predictive Analytics, Software",c_00001_00010,Southern US,8/10/2020,active,Jeremy Corbello
