name,website,short_description,linkedin,categories,num_employees_enum,locations,founded_on,operating_status,founders
volvér.vc,,volvér.vc is an early-stage investor that invests in B2B technology-enabled companies.,https://www.linkedin.com/company/volv%C3%A9r-ventures,"Finance, Financial Services, Impact Investing",,"European Union (EU), Nordic Countries, Scandinavia, Europe, Middle East, and Africa (EMEA)",1/1/2020,active,
voygr,,Go beyond business travel,,Software,c_00001_00010,,,active,Tim Baldus
vozzio,,Vozzio is a smartphone application that is helping amature singers to easily create professional studio voice tracks. ,,"Apps, Mobile, Mobile Apps",c_00001_00010,,,active,
vt3 Ventures,,vt3 Ventures is a web3 incubation and venture capital.,,,,,,active,
vubi.co Inc,,exchanging and managing contacts,,"Messaging, Social, Social Network",c_00001_00010,"European Union (EU), Europe, Middle East, and Africa (EMEA)",1/1/2013,active,"Paolo Meola, Stefano Babos"
vunify,,"Vunify helps viewers find, follow and activate content across all TV providers,.",https://www.linkedin.com/company/vunify/,Digital Entertainment,c_00001_00010,,1/1/2013,active,
vvvdotnet,,vvvdotnet operates as an investment firm.,,,,,,active,
vzw BENOR asbl,,vzw BENOR asbl is responsible for monitoring the harmonized application of the collective mark.,https://www.linkedin.com/company/npo-benor/,,,,,active,
w3.fund,,"Fueling Web3 straight from Berlin. We support the growth of the Web3 ecosystem with community, content, and cash... and a lot of pizza!",https://www.linkedin.com/company/w3fund/,"Blockchain, Cryptocurrency",,"European Union (EU), Europe, Middle East, and Africa (EMEA)",11/1/2021,active,"Feliks Eyser, Marcel Hollerbach, Michael von Roeder"
w3b.vc,,W3b.vc is an angel list syndicate investment firm.,https://www.linkedin.com/company/w3b-vc,,,"Greater New York Area, East Coast, Northeastern US",,active,
w3coins,,w3coins is a Professional Validator and Venture Capital Investment Fund. Stake Your Cryptocurrency with us to Maximize Your Earnings.,https://www.linkedin.com/company/w3coins,"Blockchain, Cryptocurrency, Virtual Currency",,"European Union (EU), Europe, Middle East, and Africa (EMEA)",,active,
waegelchen ventures,,"waegelchen ventures invests in early stage startups in food, tech and consumer hardware.",,,,"European Union (EU), Europe, Middle East, and Africa (EMEA)",1/1/2013,active,
wagmi GP,,embarking investors into web3 and guiding them through the deepest rabbit holes of the DeFi and NFT space. wagmi.,https://www.linkedin.com/company/wagmigp,"Blockchain, Cryptocurrency",,"European Union (EU), Europe, Middle East, and Africa (EMEA)",2/1/2022,active,Felix Hemmerling
wap-telecom GmbH,,wap-telecom GmbH markets and sells mobile phones.,,Electronics,,"European Union (EU), Europe, Middle East, and Africa (EMEA)",1/1/1999,active,
ward.ventures,,"ward.ventures is a private investment firm that invests in venture capital, private equity, managed funds and partnerships.",https://www.linkedin.com/company/10054401,Venture Capital,,"Dallas/Fort Worth Metroplex, Southern US",1/1/2014,active,David Ward
waresix,,"Waresix is a logistics platform for freight-forwarding, warehouse, and land transportation.",https://www.linkedin.com/company/waresix/,"E-Commerce, Freight Service, Logistics, Supply Chain Management, Transportation, Warehousing",,"Asia-Pacific (APAC), Association of Southeast Asian Nations (ASEAN), Southeast Asia",1/1/2017,active,"Andree Susanto, Edwin Wibowo"
wasel Aviation Service,,Aviation Service,,In-Flight Entertainment,c_00001_00010,"Europe, Middle East, and Africa (EMEA), Gulf Cooperation Council (GCC), Middle East",,active,Flights Services
wayra Germany,,We are one of the seven global innovation hubs of Telefónica.,https://www.linkedin.com/company/wayra-deutschland/,"Communities, Incubators, Information Technology, Innovation Management, Venture Capital",,"European Union (EU), Europe, Middle East, and Africa (EMEA)",4/1/2011,active,
wazhir yachts,,luxury yachts and boat rental,,,c_00001_00010,,9/1/2016,active,
wdrf,,gegnjy,,,,,,active,dwdw dwd
wdww,,awadda,,"Art, Cryptocurrency",c_00011_00050,"Greater New York Area, East Coast, Northeastern US",6/1/2021,active,
weBloc,,weBloc is a tokenize advertising alliance protocol company.,https://www.linkedin.com/company/webloc/,"Advertising, Marketing",,Asia-Pacific (APAC),1/1/2018,active,
weSure,,"weSure is an insurance company that offers home, mortgage, and car insurance services.",https://www.linkedin.com/company/wesure-insurance-company-ltd/,"Auto Insurance, Insurance, InsurTech, Property Insurance",,"Europe, Middle East, and Africa (EMEA), Middle East, Middle East and North Africa (MENA)",4/1/2018,active,"Emil Vainshel, Nitzan Zeir-Harim, Ruvik Klot"
weXelerate,,weXelerate is an Europe's smartest startup & innovation hub.,https://www.linkedin.com/company/wexelerate-gmbh/,Infrastructure,,"European Union (EU), Europe, Middle East, and Africa (EMEA)",9/1/2016,active,
web site design Miami FL,,Greater Your Online Layout Skills With These Tips,,Association,,,,active,Jean Delva
webbile,,webbile  is a software company.,,"Apps, Software",,"European Union (EU), Europe, Middle East, and Africa (EMEA)",,active,
webcslots,,สล็อต สล็อตออนไลน์ เว็บสล็อต สล็อตเครดิตฟรี เดิมพัน สล็อต 888 เกมสล็อต เล่นเกมได้เงิน สล็อต,,,,,,active,
websiteTOON,,"websiteTOON is an information technology, consulting, and digital marketing agency.",https://www.linkedin.com/company/websitetoon,"Consulting, Digital Marketing, Information Technology",,Great Lakes,1/1/2013,active,
weev,,Weev is an asynchronous video communication platform.,,"Information Technology, Messaging, Video",c_00001_00010,,1/1/2017,active,
well health ventures,,well health ventures are an investment arm of well-health technology.,,,,,,active,
welovefounders,,WeloveFounders is a European early-stage SaaS B2B venture capital fund dedicated to helping the next wave of European entrepreneurs.,https://www.linkedin.com/company/welovefounders/,,,"European Union (EU), Europe, Middle East, and Africa (EMEA)",9/1/2023,active,"Antoine Duchateau, Olivier Mertens, Olivier Tabery, Thomas Goubau"
welst,,Welst is a mobile applications developer. He has developed many interesting applications such as Toddler Puzzles - Animals and oddler,,"Apps, Mobile Apps",,,,active,
wepper.com gmbh,,Wepper.com gmbh provides an individual full service e-commerce solutions for manufacturers and retailers.,https://www.linkedin.com/company/wepper.com-gmbh,,,,,active,
wer-kennt-wen.de,,"Wer-kennt-wen.de is a German social networking site allowing users to write blogs, chat with friends, and write in their guestbook.",,Social Media,c_00051_00100,"European Union (EU), Europe, Middle East, and Africa (EMEA)",10/3/2006,active,
wesolveits,,"WeSolve IT Solutions in Dubai, UAE, is a leading provider of IT Support, IT consulting, and managed IT services to SME businesses.",https://www.linkedin.com/company/wesolve-it-solutions/,,,,,active,
whisp Internet,,Short reviews made by you! Get recomandations through reviews and opinions. Get the free app now!,,Software,,,8/1/2012,active,Alexander Bresk
whiteQu.be,,market research & development | digital publicity | experiential & lifestyle marketing,https://www.linkedin.com/company/whiteqube,,,"Greater Atlanta Area, East Coast, Southern US",1/1/2017,active,Vlad Gorenshteyn
whynow,,"whynow is a creative and platform that offers British stories, clothing, video content, news, and discovers emerging talent related to arts.",https://www.linkedin.com/company/whynow-ltd,"Art, Information Services, Information Technology, Mobile Apps",,"Europe, Middle East, and Africa (EMEA)",1/1/2019,active,
willoughby,,willoughby is a membership co-working space for freelancers and creative professionals services.,,"Freelance, Non Profit, Social",,Asia-Pacific (APAC),,active,
winshang.com,,Winshang is dedicated to providing timely and comprehensive information and industry data for the commercial real estate market.,https://www.linkedin.com/company/%E5%B9%BF%E4%B8%9C%E8%B5%A2%E5%95%86%E7%BD%91%E6%95%B0%E6%8D%AE%E6%9C%8D%E5%8A%A1%E8%82%A1%E4%BB%BD%E6%9C%89%E9%99%90%E5%85%AC%E5%8F%B8,"Internet, Retail",,Asia-Pacific (APAC),1/1/2010,active,
wiz,,hi just smile,,,,"Greater New York Area, East Coast, Northeastern US",,active,
wolf biotech gmbh,,wolf biotech gmbh,,,,"European Union (EU), Europe, Middle East, and Africa (EMEA)",,active,
woosah,,clips.,,,c_00001_00010,,12/1/2015,active,"Kirtan Patel, Sashi Tanuku"
workinggroup,,You can study different topics for achieving knowledge.,,,,,,active,
woyong fund,,woyong fund is an investment fund.,,,,,,active,
wundur,,Wundur is creative storytelling for the interactive generation.,,Media and Entertainment,c_00001_00010,"Greater Los Angeles Area, West Coast, Western US",1/1/2012,active,
ww88okcom,,"W88OK * W88 Thailand * ลิงค์ไปที่ w88 โบนัสเงินฝาก 100% ในปี 2023 เดิมพันฟรีที่ www.w88ok .com, ww88, w.88, ลิงค์ m.w88 .com, ไw88",https://www.linkedin.com/in/curnonwatchcom/,,,"Asia-Pacific (APAC), Association of Southeast Asian Nations (ASEAN), Southeast Asia",2/1/2018,active,
wytheville office supply,,wytheville office supply is a family-owned business with a strong community presence and a commitment to servicing the office supply needs.,,"Consulting, Office Administration",,,1/1/1948,active,
x-tention,,x-tention provides software and service solutions for healthcare industries.,https://www.linkedin.com/company/x-tention/,"Health Care, Information Services, Software",,"European Union (EU), Europe, Middle East, and Africa (EMEA)",1/1/2001,active,
x10xventures,,x10xventures is a technology advisory firm focused on startups and new-age investors.,https://www.linkedin.com/company/x10xventures,,,Asia-Pacific (APAC),1/1/2021,active,
x15ventures,,"x15ventures is a dynamic venture-building outfit, designed to bring to life the next generation of digital endeavours.",https://www.linkedin.com/company/x15ventures/,Venture Capital,,"Asia-Pacific (APAC), Australasia",1/1/2020,active,Toby Norton-Smith
x19 Studios,,X19 Studios is a publisher of mobile entertainment applications that are compatible with iPads and iPhones.,,"Apps, Mobile Apps, News",,,,active,
xCelor - Network Device,,xCelor - Network Device is a premier network technology platform.,,"Computer, Network Hardware",,"Greater Chicago Area, Great Lakes, Midwestern US",,active,
xIoTz Private Limited,,xIoTz is the creation of outstanding professional hackers from a variety of fields.,https://www.linkedin.com/company/xiotz,"Cyber Security, Information Technology, Security",,Asia-Pacific (APAC),2/2/2021,active,"Aradhana Rai, Jagan Thayananth, Sheltan Thayananth"
xMillion Capital,,xMillion Capital is an independent private equity firm that invests in early stage startup companies located across the world.,http://www.linkedin.com/company/xmillion-capital,,,"Europe, Middle East, and Africa (EMEA)",1/1/2011,active,
xRoute,,xRoute provides next generation of situational awareness to motorists through its technologies.,,"Information Technology, Navigation, Real Time, Robotics, Simulation, Software, Transportation",,"East Coast, Southern US",,active,
xSquared Ventures,,XSquared Ventures is a private investment firm that serves as a catalyst for companies that are creative and disruptive.,https://www.linkedin.com/company/xsquared-ventures/,"Banking, Financial Services, FinTech, Insurance, Venture Capital",,"East Coast, Southern US",1/1/2018,active,"Clayton Bittle, Micah Spruill"
xTechSearch,,The xTechSearch program provides non-dilutive seed prizes to small businesses to demonstrate dual-use technologies pertaining to Army needs.,,,,"Washington DC Metro Area, East Coast, Southern US",1/1/2018,active,
xTempo,,xTempo is a web-based platform that enables its users to get tasks for which they do not have time done by someone else who does.,,Internet,c_00001_00010,Latin America,,active,
xToken,,XToken is a capital markets and liquidity management platform for Web3 that gives access to financial primitives for DeFi and NFT projects.,,"Finance, Financial Services, FinTech, Trading Platform, Web3",,"San Francisco Bay Area, West Coast, Western US",1/1/2020,active,Michael J. Cohen
xVDiTeCH,,xVDITeCH is a technology company that provides work solutions in the Cloud for environments with high graphic content and computing.,https://www.linkedin.com/company/xvditech,,,,,active,
xVault,,"xVault provides e-mail solutions to government, businesses, and various industries.",,"E-Commerce, Government, Hardware, Information Technology, Robotics, Software",,"Washington DC Metro Area, East Coast, Southern US",1/1/1998,active,
xWA Growth Fund,,xWA Growth Fund is an early stage venture capital firm that invests in ventures with strong founding teams primed for global scale.,,,,,1/1/2021,active,
xaraf advisors corporation,,xaraf advisors corporation,,"Financial Services, Manufacturing, Venture Capital",,"East Coast, New England, Northeastern US",,active,
xavec,,advanced co-op hub,,,c_00011_00050,"Europe, Middle East, and Africa (EMEA)",8/31/2017,active,
xbirmedia,,xbirmedia is a software company.,https://www.linkedin.com/company/xbirmedia,,c_05001_10000,"Europe, Middle East, and Africa (EMEA), Middle East, Europe, Middle East, and Africa (EMEA)",1/1/1989,active,Deniz Karabatak
xbytesolutions,,"X-Byte Enterprise Solutions is a premier mobile app and web design development company,",,,,,,active,
xdeck,,"xdeck is a venture-platform that accelerates early-stage, data-enabled b2b tech startups",https://www.linkedin.com/company/xdeck,"Information Technology, Internet, Software",,"European Union (EU), Europe, Middle East, and Africa (EMEA)",1/1/2019,active,"Nils Eiteneyer, Oliver Steinki"
xiVENTURES Fund,,xiVENTURES Fund focuses on quality technological opportunities.,https://www.linkedin.com/company/xiventures-fund-inc/,,,Great Lakes,1/1/2016,active,
xista science ventures,,We invest in visionary science start-ups,https://www.linkedin.com/company/xsv/,"Advanced Materials, Biotechnology, CleanTech, Computer Vision, Human Computer Interaction, Information Technology, Life Science",,"European Union (EU), Europe, Middle East, and Africa (EMEA)",12/1/2017,active,Markus Wanko
xmobb,,"Social networking, games and content in a live online 3D virtual environment.",,,,,,active,
xo,,XO is a micro private equity company that offers services for the acquisition of small and profitable SaaS companies and execution.,https://www.linkedin.com/company/xo-capital,"Finance, Management Consulting, SaaS",,"Europe, Middle East, and Africa (EMEA)",1/1/2016,active,"Andrew Pierno, Tommy Jensen"
xponda,,Information Platform and Advertising,,"Advertising, Analytics, Information Technology, Marketing",,,,active,
xross,,"xross is a consulting firm that provides research & analysis, strategy and operations solutions.",,"Artificial Intelligence (AI), Big Data, Consulting",,Asia-Pacific (APAC),2/1/2018,active,
xrpl-rust,,xrpl-rust a 100% Rust library for interacting with the XRP Ledger.,,Open Source,,,,active,
xrpl.go,,xrpl-go library provides a Go implementation for interacting with the XRP Ledger.,,Software,,,,active,
xto10x Technologies,,xto10x Technologies is an Information Technology & Services company.,https://www.linkedin.com/company/xto10x-tech/,"Information Services, Information Technology, Software",,Asia-Pacific (APAC),1/1/2019,active,"Binny Bansal, Neeraj Aggarwal, Saikiran Krishnamurthy"
xxl,,xxl was founded in 2001,,Software,,,5/9/2001,active,
xxl-outdoors.de,,xxl-outdoors.de is a development company that specializes in mobile sports applications for iOS users.,,"Android, iOS, Mobile, Sports",,,,active,
xxventures,,xxventures is an incubator that provides customized programs for early-stagers on the EGC track.,,Incubators,,"San Francisco Bay Area, West Coast, Western US",6/9/2014,active,
xxxx,,Biopharmaceutical company primarily focused on the development of a promising therapy for pancreatic and ovarian cancer.,,"Biotechnology, Pharmaceutical",c_00011_00050,,1/1/2014,active,Christian Marin-Muller
xxxxxxxxxxxxxxxxxxx,,xxxxxxxxxxxxxxxxxxx,,,,"European Union (EU), Europe, Middle East, and Africa (EMEA)",,active,
xyz,,xyz,,,,,,active,"Cutter Mitchell, Steve Gonzalez"
yaEnergetik.rf,,"Service of automatic electric power metering in power companies, housing and communal services and at enterprises.",,"Energy, Renewable Energy",c_00011_00050,,,active,
yakha,,Yakha is a company that specializes in IT.Talent.Development.,https://www.linkedin.com/company/yakha-gmbh,"Recruiting, Training",c_00011_00050,"European Union (EU), Europe, Middle East, and Africa (EMEA)",1/1/2022,active,
yard[hub],,web3 venture studio and accelerator. We turn IDEAS into VENTURES.,https://www.linkedin.com/company/yard-hub,"Blockchain, Information Technology, Venture Capital, Web3",,"Europe, Middle East, and Africa (EMEA), Gulf Cooperation Council (GCC), Middle East, Middle East and North Africa (MENA)",1/1/2021,active,
yazılım24,,yazılım24 is to enable people to progress faster in a shorter time and to be better prepared for the industry.,https://www.linkedin.com/company/yaz%C4%B1l%C4%B1m24/,"Information Technology, Software",c_00001_00010,"Europe, Middle East, and Africa (EMEA), Middle East, Europe, Middle East, and Africa (EMEA)",1/1/2009,active,
yefira group,,"Yefira provides corporate financial solutions in sourcing, structuring, executing merges & acquisitions and business development.",https://www.linkedin.com/company/yefira-group/,"Business Development, Consulting, Financial Services",,"Asia-Pacific (APAC), Association of Southeast Asian Nations (ASEAN), Southeast Asia",1/1/2012,active,
yunexus,,Decentralized Identity Management Platform,,"Financial Services, Information Technology, Insurance, Internet, Internet of Things, Payments",,,5/1/2018,active,
yutori,,Yutoriis a Startup to expand the D2C business and influencer brand.,,"Advertising, Content, E-Commerce, Fashion",,Asia-Pacific (APAC),4/4/2018,active,Shunsuke Matsubara
zVentures,,Emerging companies with opportunities for massive growth and improvement,,"Angel Investment, Finance, Venture Capital",,"San Francisco Bay Area, West Coast, Western US",9/12/2016,active,Min-Liang Tan
zahnco,,"Die Pflege deiner Zähne sollte nicht nur etwas sein, was du tun musst, sondern fester Bestandteil deines Lifestyles sein.",,,,,,active,
© MY CORPORATIONS HOLDING,,"HOLDING, VENTURE CAPITAL",,,c_00051_00100,"Greater New York Area, East Coast, Northeastern US",2/1/2009,active,
Àlber Blanc,,"Unite of innovative companies in the field of finance, digital assets, telecommunications and autonomous flying vehicles",https://www.linkedin.com/company/alberblanc/,"Asset Management, Autonomous Vehicles, Finance, Telecommunications",,"European Union (EU), Europe, Middle East, and Africa (EMEA)",7/25/2020,active,Anton Babushkin
Ágathos Group,,"Ágathos transform people through Education, setting an example in innovative learning and management practices",https://www.linkedin.com/company/escola-superior-'ci-ncias-e-letras',,,Latin America,1/1/1973,active,
Ääkköset Oy,,We invest in inspiring innovations driven by true entrepreneurs. Lets accelerate the productization to make a global impact.,https://www.linkedin.com/company/%C3%A4%C3%A4kk%C3%B6set-oy/,,,"European Union (EU), Nordic Countries, Scandinavia, Europe, Middle East, and Africa (EMEA)",10/7/2016,active,"Jani Kenttälä, Joachim Viide"
Å Energi,,Å Energi is Creating a world powered by clean energy.,https://www.linkedin.com/company/%C3%A5-energi/,"Manufacturing, Renewable Energy, Semiconductor",,"Nordic Countries, Scandinavia, Europe, Middle East, and Africa (EMEA)",,active,
Åland Telefonandelslag,,Åland Telefonandelslag is a user-owned telephone company.,,Wired Telecommunications,,"European Union (EU), Nordic Countries, Scandinavia, Europe, Middle East, and Africa (EMEA)",,active,
"Ålands Ömsesidiga Försäkringsbolag,",,Ålands Ömsesidiga Försäkringsbolag (Åland's Mutual Insurance Company) is an Åland-based non-life insurance company.,https://www.linkedin.com/company/-lands-msesidiga-f-rs-kringsbolag/,,,"European Union (EU), Nordic Countries, Scandinavia, Europe, Middle East, and Africa (EMEA)",1866-01-01,active,
Ålandsbanken,,"Alandsbanken provides retail banking, corporate finance, asset management, and private banking services to institutions and individuals.",https://www.linkedin.com/company/-landsbanken-abp/,"Asset Management, Banking, Finance, Financial Services",,"European Union (EU), Nordic Countries, Scandinavia, Europe, Middle East, and Africa (EMEA)",1/1/1919,active,
Ålesund University College,,The Norwegian University of Science and Technology (NTNU) is a public university in Norway and the largest university.,https://www.linkedin.com/school/ntnu-i-alesund/,,,,,active,
Årdal Energi,,Årdal Energi is an investment firm.,,,,"Nordic Countries, Scandinavia, Europe, Middle East, and Africa (EMEA)",,active,
Åva High School,,Åva High School is an educational institution.,https://www.linkedin.com/company/taby-kommun,,,"European Union (EU), Nordic Countries, Scandinavia, Europe, Middle East, and Africa (EMEA)",,active,
Çalık Enerji,,Çalık Enerji offers natural energy to work for people in order to build a better and more sustainable future.,https://www.linkedin.com/company/calik-enerji/,"Energy, Natural Resources, Renewable Energy",,"Europe, Middle East, and Africa (EMEA), Middle East, Middle East and North Africa (MENA), Europe, Middle East, and Africa (EMEA)",1/1/1988,active,
Çanakkale Onsekiz Mart University,,"Çanakkale Onsekiz Mart University is a public research university offering R&D, application-oriented, and project-based research courses.",https://www.linkedin.com/school/canakkale-onsekiz-mart-university,Higher Education,,"Europe, Middle East, and Africa (EMEA), Middle East, Middle East and North Africa (MENA), Europe, Middle East, and Africa (EMEA)",1/1/1992,active,
ÉCOLE NATIONALE SUPÉRIEURE DE CRÉATION INDUSTRIELLE,,"ENSCI–Les Ateliers, is a French design school located in the 11th arrondissement of Paris.",https://www.linkedin.com/school/ensci/?originalSubdomain=fr,"Education, Higher Education, Industrial Design",,"European Union (EU), Europe, Middle East, and Africa (EMEA)",11/8/1982,active,
École 3A - L'école internationale du management responsable,,École 3A - L'école internationale du management responsable provide Higher Education.,https://www.linkedin.com/school/3a-ecole-du-management-responsable-et-solidaire,,,"European Union (EU), Europe, Middle East, and Africa (EMEA)",1/1/1984,active,
École Amédée-Boisvert,,École Amédée-Boisvert is a St-Albert elementary school.,,Primary Education,,,,active,
École Des Explorateurs,,"École Des Explorateurs is a primary school in Malartic, Quebec, Canada.",,Education,,,,active,
École Européenne Bruxelles III,,"École Européenne Bruxelles III is a school that offers physical, arts, and music education for students.",https://www.linkedin.com/company/european-school-of-brussels-3/,"Education, Higher Education, Training",,"European Union (EU), Europe, Middle East, and Africa (EMEA)",1/1/1999,active,
École Internationale de Mode & Luxe,,"EIDM offers students a range of specialized programs from Bachelor's to Master's, as well as recognized professional diplomas.",https://fr.linkedin.com/school/eidm-ecole-internationale-de-mode-luxe/,"Education, Higher Education, Professional Services",,"European Union (EU), Europe, Middle East, and Africa (EMEA)",1/1/2007,active,
École Montmartre,,"École Montmartre Elementary in Montreal, Canada",,"Education, Primary Education, Secondary Education",,,,active,
École Nationale des Arts Visuels de La Cambre,,École Nationale des Arts Visuels de La Cambre,,,,,,active,
École Secondaire Saint-Laurent,,École Secondaire Saint-Laurent is a Francophone public and mixed secondary school located in the Saint-Laurent borough in Montreal.,,,,,,active,
École alsacienne,,"École alsacienne provides education for nursery, elementary classes, middle and high school classes.",https://www.linkedin.com/school/ecole-alsacienne,"Education, Higher Education, Secondary Education",,"European Union (EU), Europe, Middle East, and Africa (EMEA)",1874-01-01,active,
École centrale de Nantes,,École centrale de Nantes is a french engineering school.,https://www.linkedin.com/school/74461/,,,"European Union (EU), Europe, Middle East, and Africa (EMEA)",1/1/1919,active,
École d'Entrepreneurship de Beauce (EEB),,École d'Entrepreneurship de Beauce (EEB) is a trade school.,https://www.linkedin.com/company/-cole-d'entrepreneurship-de-beauce,,,,1/1/2010,active,
École d'Éducation Internationale,,Ecole d`Education Internationale is a Co-Educational Private School.,,Education,,,,active,
École des métiers du meubles de Montréal,,École des métiers du meubles de Montréal is an educational institution.,,,,,,active,
École nationale supérieure d'architecture de Paris-Val de Seine,,École nationale supérieure d'architecture de Paris-Val de Seine is characterized by the great diversity of its educational offering.,,"Education, Higher Education",,"European Union (EU), Europe, Middle East, and Africa (EMEA)",1/1/1999,active,
École nationale supérieure de paysage,,"École nationale supérieure de paysage is a landscape design school and a recognized center for training, research, and production.",https://www.linkedin.com/school/enspaysage,,,,,active,
